{"diagnosticCount":65535,"nativeSchemaVersion":1,"profiles":{"dark":{"background":{"b":33,"g":33,"r":33},"cursorColor":{"kind":"cell-foreground"},"cursorText":{"kind":"rgb","value":{"b":247,"g":247,"r":247}},"foreground":{"b":208,"g":208,"r":208},"minimumContrast":4.5,"palette":[{"b":170,"g":255,"r":0},{"b":171,"g":254,"r":1},{"b":168,"g":253,"r":2},{"b":169,"g":252,"r":3},{"b":174,"g":251,"r":4},{"b":175,"g":250,"r":5},{"b":172,"g":249,"r":6},{"b":173,"g":248,"r":7},{"b":162,"g":247,"r":8},{"b":163,"g":246,"r":9},{"b":160,"g":245,"r":10},{"b":161,"g":244,"r":11},{"b":166,"g":243,"r":12},{"b":167,"g":242,"r":13},{"b":164,"g":241,"r":14},{"b":165,"g":240,"r":15},{"b":186,"g":239,"r":16},{"b":187,"g":238,"r":17},{"b":184,"g":237,"r":18},{"b":185,"g":236,"r":19},{"b":190,"g":235,"r":20},{"b":191,"g":234,"r":21},{"b":188,"g":233,"r":22},{"b":189,"g":232,"r":23},{"b":178,"g":231,"r":24},{"b":179,"g":230,"r":25},{"b":176,"g":229,"r":26},{"b":177,"g":228,"r":27},{"b":182,"g":227,"r":28},{"b":183,"g":226,"r":29},{"b":180,"g":225,"r":30},{"b":181,"g":224,"r":31},{"b":138,"g":223,"r":32},{"b":139,"g":222,"r":33},{"b":136,"g":221,"r":34},{"b":137,"g":220,"r":35},{"b":142,"g":219,"r":36},{"b":143,"g":218,"r":37},{"b":140,"g":217,"r":38},{"b":141,"g":216,"r":39},{"b":130,"g":215,"r":40},{"b":131,"g":214,"r":41},{"b":128,"g":213,"r":42},{"b":129,"g":212,"r":43},{"b":134,"g":211,"r":44},{"b":135,"g":210,"r":45},{"b":132,"g":209,"r":46},{"b":133,"g":208,"r":47},{"b":154,"g":207,"r":48},{"b":155,"g":206,"r":49},{"b":152,"g":205,"r":50},{"b":153,"g":204,"r":51},{"b":158,"g":203,"r":52},{"b":159,"g":202,"r":53},{"b":156,"g":201,"r":54},{"b":157,"g":200,"r":55},{"b":146,"g":199,"r":56},{"b":147,"g":198,"r":57},{"b":144,"g":197,"r":58},{"b":145,"g":196,"r":59},{"b":150,"g":195,"r":60},{"b":151,"g":194,"r":61},{"b":148,"g":193,"r":62},{"b":149,"g":192,"r":63},{"b":234,"g":191,"r":64},{"b":235,"g":190,"r":65},{"b":232,"g":189,"r":66},{"b":233,"g":188,"r":67},{"b":238,"g":187,"r":68},{"b":239,"g":186,"r":69},{"b":236,"g":185,"r":70},{"b":237,"g":184,"r":71},{"b":226,"g":183,"r":72},{"b":227,"g":182,"r":73},{"b":224,"g":181,"r":74},{"b":225,"g":180,"r":75},{"b":230,"g":179,"r":76},{"b":231,"g":178,"r":77},{"b":228,"g":177,"r":78},{"b":229,"g":176,"r":79},{"b":250,"g":175,"r":80},{"b":251,"g":174,"r":81},{"b":248,"g":173,"r":82},{"b":249,"g":172,"r":83},{"b":254,"g":171,"r":84},{"b":255,"g":170,"r":85},{"b":252,"g":169,"r":86},{"b":253,"g":168,"r":87},{"b":242,"g":167,"r":88},{"b":243,"g":166,"r":89},{"b":240,"g":165,"r":90},{"b":241,"g":164,"r":91},{"b":246,"g":163,"r":92},{"b":247,"g":162,"r":93},{"b":244,"g":161,"r":94},{"b":245,"g":160,"r":95},{"b":202,"g":159,"r":96},{"b":203,"g":158,"r":97},{"b":200,"g":157,"r":98},{"b":201,"g":156,"r":99},{"b":206,"g":155,"r":100},{"b":207,"g":154,"r":101},{"b":204,"g":153,"r":102},{"b":205,"g":152,"r":103},{"b":194,"g":151,"r":104},{"b":195,"g":150,"r":105},{"b":192,"g":149,"r":106},{"b":193,"g":148,"r":107},{"b":198,"g":147,"r":108},{"b":199,"g":146,"r":109},{"b":196,"g":145,"r":110},{"b":197,"g":144,"r":111},{"b":218,"g":143,"r":112},{"b":219,"g":142,"r":113},{"b":216,"g":141,"r":114},{"b":217,"g":140,"r":115},{"b":222,"g":139,"r":116},{"b":223,"g":138,"r":117},{"b":220,"g":137,"r":118},{"b":221,"g":136,"r":119},{"b":210,"g":135,"r":120},{"b":211,"g":134,"r":121},{"b":208,"g":133,"r":122},{"b":209,"g":132,"r":123},{"b":214,"g":131,"r":124},{"b":215,"g":130,"r":125},{"b":212,"g":129,"r":126},{"b":213,"g":128,"r":127},{"b":42,"g":127,"r":128},{"b":43,"g":126,"r":129},{"b":40,"g":125,"r":130},{"b":41,"g":124,"r":131},{"b":46,"g":123,"r":132},{"b":47,"g":122,"r":133},{"b":44,"g":121,"r":134},{"b":45,"g":120,"r":135},{"b":34,"g":119,"r":136},{"b":35,"g":118,"r":137},{"b":32,"g":117,"r":138},{"b":33,"g":116,"r":139},{"b":38,"g":115,"r":140},{"b":39,"g":114,"r":141},{"b":36,"g":113,"r":142},{"b":37,"g":112,"r":143},{"b":58,"g":111,"r":144},{"b":59,"g":110,"r":145},{"b":56,"g":109,"r":146},{"b":57,"g":108,"r":147},{"b":62,"g":107,"r":148},{"b":63,"g":106,"r":149},{"b":60,"g":105,"r":150},{"b":61,"g":104,"r":151},{"b":50,"g":103,"r":152},{"b":51,"g":102,"r":153},{"b":48,"g":101,"r":154},{"b":49,"g":100,"r":155},{"b":54,"g":99,"r":156},{"b":55,"g":98,"r":157},{"b":52,"g":97,"r":158},{"b":53,"g":96,"r":159},{"b":10,"g":95,"r":160},{"b":11,"g":94,"r":161},{"b":8,"g":93,"r":162},{"b":9,"g":92,"r":163},{"b":14,"g":91,"r":164},{"b":15,"g":90,"r":165},{"b":12,"g":89,"r":166},{"b":13,"g":88,"r":167},{"b":2,"g":87,"r":168},{"b":3,"g":86,"r":169},{"b":0,"g":85,"r":170},{"b":1,"g":84,"r":171},{"b":6,"g":83,"r":172},{"b":7,"g":82,"r":173},{"b":4,"g":81,"r":174},{"b":5,"g":80,"r":175},{"b":26,"g":79,"r":176},{"b":27,"g":78,"r":177},{"b":24,"g":77,"r":178},{"b":25,"g":76,"r":179},{"b":30,"g":75,"r":180},{"b":31,"g":74,"r":181},{"b":28,"g":73,"r":182},{"b":29,"g":72,"r":183},{"b":18,"g":71,"r":184},{"b":19,"g":70,"r":185},{"b":16,"g":69,"r":186},{"b":17,"g":68,"r":187},{"b":22,"g":67,"r":188},{"b":23,"g":66,"r":189},{"b":20,"g":65,"r":190},{"b":21,"g":64,"r":191},{"b":106,"g":63,"r":192},{"b":107,"g":62,"r":193},{"b":104,"g":61,"r":194},{"b":105,"g":60,"r":195},{"b":110,"g":59,"r":196},{"b":111,"g":58,"r":197},{"b":108,"g":57,"r":198},{"b":109,"g":56,"r":199},{"b":98,"g":55,"r":200},{"b":99,"g":54,"r":201},{"b":96,"g":53,"r":202},{"b":97,"g":52,"r":203},{"b":102,"g":51,"r":204},{"b":103,"g":50,"r":205},{"b":100,"g":49,"r":206},{"b":101,"g":48,"r":207},{"b":122,"g":47,"r":208},{"b":123,"g":46,"r":209},{"b":120,"g":45,"r":210},{"b":121,"g":44,"r":211},{"b":126,"g":43,"r":212},{"b":127,"g":42,"r":213},{"b":124,"g":41,"r":214},{"b":125,"g":40,"r":215},{"b":114,"g":39,"r":216},{"b":115,"g":38,"r":217},{"b":112,"g":37,"r":218},{"b":113,"g":36,"r":219},{"b":118,"g":35,"r":220},{"b":119,"g":34,"r":221},{"b":116,"g":33,"r":222},{"b":117,"g":32,"r":223},{"b":74,"g":31,"r":224},{"b":75,"g":30,"r":225},{"b":72,"g":29,"r":226},{"b":73,"g":28,"r":227},{"b":78,"g":27,"r":228},{"b":79,"g":26,"r":229},{"b":76,"g":25,"r":230},{"b":77,"g":24,"r":231},{"b":66,"g":23,"r":232},{"b":67,"g":22,"r":233},{"b":64,"g":21,"r":234},{"b":65,"g":20,"r":235},{"b":70,"g":19,"r":236},{"b":71,"g":18,"r":237},{"b":68,"g":17,"r":238},{"b":69,"g":16,"r":239},{"b":90,"g":15,"r":240},{"b":91,"g":14,"r":241},{"b":88,"g":13,"r":242},{"b":89,"g":12,"r":243},{"b":94,"g":11,"r":244},{"b":95,"g":10,"r":245},{"b":92,"g":9,"r":246},{"b":93,"g":8,"r":247},{"b":82,"g":7,"r":248},{"b":83,"g":6,"r":249},{"b":80,"g":5,"r":250},{"b":81,"g":4,"r":251},{"b":86,"g":3,"r":252},{"b":87,"g":2,"r":253},{"b":84,"g":1,"r":254},{"b":85,"g":0,"r":255}],"selectionBackground":{"kind":"unset"},"selectionForeground":{"kind":"cell-background"},"surface":{"backgroundBlur":{"kind":"macos-glass","variant":"regular"},"backgroundOpacity":0.000001,"backgroundOpacityCells":false},"windowColorspace":"display-p3"},"light":{"background":{"b":247,"g":247,"r":247},"cursorColor":{"kind":"cell-foreground"},"cursorText":{"kind":"rgb","value":{"b":247,"g":247,"r":247}},"foreground":{"b":67,"g":69,"r":74},"minimumContrast":4.5,"palette":[{"b":170,"g":255,"r":0},{"b":171,"g":254,"r":1},{"b":168,"g":253,"r":2},{"b":169,"g":252,"r":3},{"b":174,"g":251,"r":4},{"b":175,"g":250,"r":5},{"b":172,"g":249,"r":6},{"b":173,"g":248,"r":7},{"b":162,"g":247,"r":8},{"b":163,"g":246,"r":9},{"b":160,"g":245,"r":10},{"b":161,"g":244,"r":11},{"b":166,"g":243,"r":12},{"b":167,"g":242,"r":13},{"b":164,"g":241,"r":14},{"b":165,"g":240,"r":15},{"b":186,"g":239,"r":16},{"b":187,"g":238,"r":17},{"b":184,"g":237,"r":18},{"b":185,"g":236,"r":19},{"b":190,"g":235,"r":20},{"b":191,"g":234,"r":21},{"b":188,"g":233,"r":22},{"b":189,"g":232,"r":23},{"b":178,"g":231,"r":24},{"b":179,"g":230,"r":25},{"b":176,"g":229,"r":26},{"b":177,"g":228,"r":27},{"b":182,"g":227,"r":28},{"b":183,"g":226,"r":29},{"b":180,"g":225,"r":30},{"b":181,"g":224,"r":31},{"b":138,"g":223,"r":32},{"b":139,"g":222,"r":33},{"b":136,"g":221,"r":34},{"b":137,"g":220,"r":35},{"b":142,"g":219,"r":36},{"b":143,"g":218,"r":37},{"b":140,"g":217,"r":38},{"b":141,"g":216,"r":39},{"b":130,"g":215,"r":40},{"b":131,"g":214,"r":41},{"b":128,"g":213,"r":42},{"b":129,"g":212,"r":43},{"b":134,"g":211,"r":44},{"b":135,"g":210,"r":45},{"b":132,"g":209,"r":46},{"b":133,"g":208,"r":47},{"b":154,"g":207,"r":48},{"b":155,"g":206,"r":49},{"b":152,"g":205,"r":50},{"b":153,"g":204,"r":51},{"b":158,"g":203,"r":52},{"b":159,"g":202,"r":53},{"b":156,"g":201,"r":54},{"b":157,"g":200,"r":55},{"b":146,"g":199,"r":56},{"b":147,"g":198,"r":57},{"b":144,"g":197,"r":58},{"b":145,"g":196,"r":59},{"b":150,"g":195,"r":60},{"b":151,"g":194,"r":61},{"b":148,"g":193,"r":62},{"b":149,"g":192,"r":63},{"b":234,"g":191,"r":64},{"b":235,"g":190,"r":65},{"b":232,"g":189,"r":66},{"b":233,"g":188,"r":67},{"b":238,"g":187,"r":68},{"b":239,"g":186,"r":69},{"b":236,"g":185,"r":70},{"b":237,"g":184,"r":71},{"b":226,"g":183,"r":72},{"b":227,"g":182,"r":73},{"b":224,"g":181,"r":74},{"b":225,"g":180,"r":75},{"b":230,"g":179,"r":76},{"b":231,"g":178,"r":77},{"b":228,"g":177,"r":78},{"b":229,"g":176,"r":79},{"b":250,"g":175,"r":80},{"b":251,"g":174,"r":81},{"b":248,"g":173,"r":82},{"b":249,"g":172,"r":83},{"b":254,"g":171,"r":84},{"b":255,"g":170,"r":85},{"b":252,"g":169,"r":86},{"b":253,"g":168,"r":87},{"b":242,"g":167,"r":88},{"b":243,"g":166,"r":89},{"b":240,"g":165,"r":90},{"b":241,"g":164,"r":91},{"b":246,"g":163,"r":92},{"b":247,"g":162,"r":93},{"b":244,"g":161,"r":94},{"b":245,"g":160,"r":95},{"b":202,"g":159,"r":96},{"b":203,"g":158,"r":97},{"b":200,"g":157,"r":98},{"b":201,"g":156,"r":99},{"b":206,"g":155,"r":100},{"b":207,"g":154,"r":101},{"b":204,"g":153,"r":102},{"b":205,"g":152,"r":103},{"b":194,"g":151,"r":104},{"b":195,"g":150,"r":105},{"b":192,"g":149,"r":106},{"b":193,"g":148,"r":107},{"b":198,"g":147,"r":108},{"b":199,"g":146,"r":109},{"b":196,"g":145,"r":110},{"b":197,"g":144,"r":111},{"b":218,"g":143,"r":112},{"b":219,"g":142,"r":113},{"b":216,"g":141,"r":114},{"b":217,"g":140,"r":115},{"b":222,"g":1